{
  "$schema": "https://json-schema.org/draft/2020-12/schema",
  "title": "Manifest",
  "description": "Generic raw dataset manifest, parameterized by dataset kind `K`.\n\nAll raw datasets share the same structure: a typed kind, network identifier,\noptional start block, finalization preference, and table definitions.",
  "type": "object",
  "properties": {
    "finalized_blocks_only": {
      "description": "Only include finalized block data.",
      "type": "boolean",
      "default": false
    },
    "kind": {
      "description": "Dataset kind identifier.",
      "$ref": "#/$defs/RawDatasetKind"
    },
    "network": {
      "description": "Network name.",
      "$ref": "#/$defs/NetworkId",
      "examples": [
        "mainnet",
        "base",
        "solana-mainnet"
      ]
    },
    "start_block": {
      "description": "Dataset start block.",
      "type": "integer",
      "format": "uint64",
      "default": 0,
      "minimum": 0
    },
    "tables": {
      "description": "Dataset tables. Maps table names to their definitions.",
      "type": "object",
      "additionalProperties": {
        "$ref": "#/$defs/Table"
      }
    }
  },
  "required": [
    "kind",
    "network",
    "tables"
  ],
  "$defs": {
    "ArrowSchema": {
      "description": "Arrow schema representation for serialization.\n\nContains an ordered list of fields that define the structure of a table.",
      "type": "object",
      "properties": {
        "fields": {
          "description": "Ordered list of fields in the schema",
          "type": "array",
          "items": {
            "$ref": "#/$defs/Field"
          },
          "minItems": 1
        }
      },
      "required": [
        "fields"
      ]
    },
    "DataType": {
      "description": "Arrow data type, e.g. `Int32`, `Utf8`, etc.",
      "type": "string"
    },
    "Field": {
      "description": "Arrow field definition with name, type, and nullability.\n\nRepresents a single column in a table schema.",
      "type": "object",
      "properties": {
        "name": {
          "description": "Field name",
          "type": "string"
        },
        "nullable": {
          "description": "Whether the field can contain null values",
          "type": "boolean"
        },
        "type": {
          "description": "Arrow data type of the field",
          "$ref": "#/$defs/DataType"
        }
      },
      "required": [
        "name",
        "type",
        "nullable"
      ]
    },
    "NetworkId": {
      "description": "A validated network identifier that enforces basic constraints.\n\nNetwork identifiers are used to distinguish between different blockchain networks\n(e.g., \"mainnet\", \"base\", \"arbitrum-one\"). This type provides compile-time guarantees\nthat all instances contain valid network identifiers.\n\nNetwork IDs should follow the values defined in The Graph's networks registry:\n<https://github.com/graphprotocol/networks-registry/blob/main/docs/networks-table.md>\n\n## Format Requirements\n\nA valid network identifier must:\n- **Not be empty** (minimum length of 1 character)",
      "type": "string",
      "minLength": 1
    },
    "RawDatasetKind": {
      "description": "Unified enum of all raw dataset kinds, used for JSON schema generation.\n\nThis enum produces `{\"enum\": [\"evm-rpc\", \"firehose\", \"solana\"]}` in the JSON schema,\nallowing a single schema file to cover all raw dataset kinds.",
      "type": "string",
      "enum": [
        "evm-rpc",
        "firehose",
        "solana",
        "tempo"
      ]
    },
    "Table": {
      "description": "Table definition for raw dataset manifests.",
      "type": "object",
      "properties": {
        "network": {
          "description": "Network for this table.",
          "$ref": "#/$defs/NetworkId"
        },
        "schema": {
          "description": "Arrow schema for this table.",
          "$ref": "#/$defs/TableSchema"
        }
      },
      "required": [
        "schema",
        "network"
      ]
    },
    "TableSchema": {
      "description": "Schema definition for a table.\n\nWraps an Arrow schema with field definitions including names, types, and nullability.",
      "type": "object",
      "properties": {
        "arrow": {
          "description": "Arrow schema definition",
          "$ref": "#/$defs/ArrowSchema"
        }
      },
      "required": [
        "arrow"
      ]
    }
  }
}