{
  "kind": "evm-rpc",
  "network": "base-mainnet",
  "start_block": 33411770,
  "finalized_blocks_only": false,
  "tables": {
    "blocks": {
      "schema": {
        "arrow": {
          "fields": [
            {
              "name": "block_num",
              "type": "UInt64",
              "nullable": false
            },
            {
              "name": "timestamp",
              "type": {
                "Timestamp": [
                  "Nanosecond",
                  "+00:00"
                ]
              },
              "nullable": false
            },
            {
              "name": "hash",
              "type": {
                "FixedSizeBinary": 32
              },
              "nullable": false
            },
            {
              "name": "parent_hash",
              "type": {
                "FixedSizeBinary": 32
              },
              "nullable": false
            },
            {
              "name": "ommers_hash",
              "type": {
                "FixedSizeBinary": 32
              },
              "nullable": false
            },
            {
              "name": "miner",
              "type": {
                "FixedSizeBinary": 20
              },
              "nullable": false
            },
            {
              "name": "state_root",
              "type": {
                "FixedSizeBinary": 32
              },
              "nullable": false
            },
            {
              "name": "transactions_root",
              "type": {
                "FixedSizeBinary": 32
              },
              "nullable": false
            },
            {
              "name": "receipt_root",
              "type": {
                "FixedSizeBinary": 32
              },
              "nullable": false
            },
            {
              "name": "logs_bloom",
              "type": "Binary",
              "nullable": false
            },
            {
              "name": "difficulty",
              "type": {
                "Decimal128": [
                  38,
                  0
                ]
              },
              "nullable": false
            },
            {
              "name": "gas_limit",
              "type": "UInt64",
              "nullable": false
            },
            {
              "name": "gas_used",
              "type": "UInt64",
              "nullable": false
            },
            {
              "name": "extra_data",
              "type": "Binary",
              "nullable": false
            },
            {
              "name": "mix_hash",
              "type": {
                "FixedSizeBinary": 32
              },
              "nullable": false
            },
            {
              "name": "nonce",
              "type": "UInt64",
              "nullable": false
            },
            {
              "name": "base-mainnet_fee_per_gas",
              "type": {
                "Decimal128": [
                  38,
                  0
                ]
              },
              "nullable": true
            },
            {
              "name": "withdrawals_root",
              "type": {
                "FixedSizeBinary": 32
              },
              "nullable": true
            },
            {
              "name": "blob_gas_used",
              "type": "UInt64",
              "nullable": true
            },
            {
              "name": "excess_blob_gas",
              "type": "UInt64",
              "nullable": true
            },
            {
              "name": "parent_beacon_root",
              "type": {
                "FixedSizeBinary": 32
              },
              "nullable": true
            }
          ]
        }
      },
      "network": "base-mainnet"
    },
    "logs": {
      "schema": {
        "arrow": {
          "fields": [
            {
              "name": "block_hash",
              "type": {
                "FixedSizeBinary": 32
              },
              "nullable": false
            },
            {
              "name": "block_num",
              "type": "UInt64",
              "nullable": false
            },
            {
              "name": "timestamp",
              "type": {
                "Timestamp": [
                  "Nanosecond",
                  "+00:00"
                ]
              },
              "nullable": false
            },
            {
              "name": "tx_hash",
              "type": {
                "FixedSizeBinary": 32
              },
              "nullable": false
            },
            {
              "name": "tx_index",
              "type": "UInt32",
              "nullable": false
            },
            {
              "name": "log_index",
              "type": "UInt32",
              "nullable": false
            },
            {
              "name": "address",
              "type": {
                "FixedSizeBinary": 20
              },
              "nullable": false
            },
            {
              "name": "topic0",
              "type": {
                "FixedSizeBinary": 32
              },
              "nullable": true
            },
            {
              "name": "topic1",
              "type": {
                "FixedSizeBinary": 32
              },
              "nullable": true
            },
            {
              "name": "topic2",
              "type": {
                "FixedSizeBinary": 32
              },
              "nullable": true
            },
            {
              "name": "topic3",
              "type": {
                "FixedSizeBinary": 32
              },
              "nullable": true
            },
            {
              "name": "data",
              "type": "Binary",
              "nullable": false
            }
          ]
        }
      },
      "network": "base-mainnet"
    },
    "transactions": {
      "schema": {
        "arrow": {
          "fields": [
            {
              "name": "block_hash",
              "type": {
                "FixedSizeBinary": 32
              },
              "nullable": false
            },
            {
              "name": "block_num",
              "type": "UInt64",
              "nullable": false
            },
            {
              "name": "timestamp",
              "type": {
                "Timestamp": [
                  "Nanosecond",
                  "+00:00"
                ]
              },
              "nullable": false
            },
            {
              "name": "tx_index",
              "type": "UInt32",
              "nullable": false
            },
            {
              "name": "tx_hash",
              "type": {
                "FixedSizeBinary": 32
              },
              "nullable": false
            },
            {
              "name": "to",
              "type": {
                "FixedSizeBinary": 20
              },
              "nullable": true
            },
            {
              "name": "nonce",
              "type": "UInt64",
              "nullable": false
            },
            {
              "name": "gas_price",
              "type": {
                "Decimal128": [
                  38,
                  0
                ]
              },
              "nullable": true
            },
            {
              "name": "gas_limit",
              "type": "UInt64",
              "nullable": false
            },
            {
              "name": "value",
              "type": {
                "Decimal128": [
                  38,
                  0
                ]
              },
              "nullable": false
            },
            {
              "name": "input",
              "type": "Binary",
              "nullable": false
            },
            {
              "name": "v",
              "type": "Binary",
              "nullable": false
            },
            {
              "name": "r",
              "type": "Binary",
              "nullable": false
            },
            {
              "name": "s",
              "type": "Binary",
              "nullable": false
            },
            {
              "name": "gas_used",
              "type": "UInt64",
              "nullable": false
            },
            {
              "name": "type",
              "type": "Int32",
              "nullable": false
            },
            {
              "name": "max_fee_per_gas",
              "type": {
                "Decimal128": [
                  38,
                  0
                ]
              },
              "nullable": true
            },
            {
              "name": "max_priority_fee_per_gas",
              "type": {
                "Decimal128": [
                  38,
                  0
                ]
              },
              "nullable": true
            },
            {
              "name": "max_fee_per_blob_gas",
              "type": {
                "Decimal128": [
                  38,
                  0
                ]
              },
              "nullable": true
            },
            {
              "name": "from",
              "type": {
                "FixedSizeBinary": 20
              },
              "nullable": false
            },
            {
              "name": "status",
              "type": "Boolean",
              "nullable": false
            }
          ]
        }
      },
      "network": "base-mainnet"
    }
  }
}